"county","state","bidDate","projectName","projectLink","bidID","estimate","type","owner","location","scope","preBidDate","preBidTime","preBidLocation","bidTime","bidLocation","contactName","contactPhone","contactEmail"
"4/08/2025","State: TX","081-011-13-02 DST (J) / ROAD (L)","BCMUD No. 57 Water, Wastewater, Storm and Paving to serve Meridiana Section Thirteen-B","https://www.civcastusa.com/project/67dd763839a867800709c2a2/summary","081-011-13-02 DST (J) / ROAD (L)","N/A","N/A","N/A","Brazoria County, TX","Project scope shall include the installation of approximately 1,200 LF of 8” PVC waterline; 1,230 LF of 8” PVC sanitary sewer; 700 LF of 24”-36” RCP storm sewer; and 6,075 SY of 6” concrete paving.","081-011-13-02 DST (J) / ROAD (L)","N/A","N/A","N/A","N/A","081-011-13-02 DST (J) / ROAD (L)","N/A","N/A"
"4/08/2025","State: TX","201-051-01 DST (J) / DEV (L)","Water, Wastewater, Storm, and Paving to serve Villa Greens Section One","https://www.civcastusa.com/project/67dadfd4111f740201f5ef11/summary","201-051-01 DST (J) / DEV (L)","N/A","N/A","N/A","Harris County, TX","Project scope shall include the installation of 4,550 LF of 6”- 8” PVC waterline; 3,285 LF of 8” PVC gravity sanitary sewer; 2,940 LF of 24”- 42” Polypropylene Pipe storm sewer; and 12,210 SY of 6” reinforced concrete.","201-051-01 DST (J) / DEV (L)","N/A","N/A","N/A","N/A","201-051-01 DST (J) / DEV (L)","N/A","N/A"
"4/08/2025","State: TX","RFP 2025-05-422","RFP 2025-05-422 REMOVAL AND DISPOSAL OF WASTEWATER TREATMENT PLANT SLUDGE/RAGS/DEBRIS","https://www.civcastusa.com/project/67daf06611660c607da0d4e5/summary","RFP 2025-05-422","N/A","N/A","N/A","Harris County, TX","City of Seabrook

Notice to Bidders

Sealed Bid Project #2025-05-422

Removal and Disposal of Wastewater Treatment Plant Sludge/Rags/Debris

 

Sealed Request for Proposals for Removal and Disposal of Wastewater Treatment Plant Sludge/Rags/Debris, Seabrook Project No. 2025-05-422 will be received until 2:00 PM on April 08, 2025, by the Purchasing Coordinator, Rebecca Howton, 1700 First Street, Seabrook, Texas 77586. Bids must be received and time stamped by the Purchasing Coordinator prior to the aforementioned time, when they will be publicly opened and read aloud in City Council Chambers. No late bids will be accepted. Bidding documents may be obtained from the City Website at www.Seabrooktx.gov or by contacting the Purchasing Coordinator, Rebecca Howton through email at purchasing@seabrooktx.gov.

 

RFPs may also be submitted electronically through Public Purchase.  To submit an RFP electronically, an account will need to be created in Public Purchase, and then RFP 2025-05-422 can be accessed for electronic submission.  Electronic RFPs must be submitted before the 2:00 pm deadline on April 08, 2025.  Please visit https://www.publicpurchase.com/gems/register/vendor/register to register or login with Public Purchase.

 

The City of Seabrook hereby notifies all BIDDERS that in regard to any agreement entered into pursuant to this advertisement, minority business enterprises will be afforded equal opportunities to submit bids in response to this invitation and will not be discriminated against on the grounds of race, color, sex, age, religion, or national origin in consideration for an award.

 

Until final award of the Contract, City of Seabrook reserves the right to reject any or all Bids, to waive irregularities or technicalities, to re-advertise, or to proceed to do the work otherwise when in the best interest of the City of Seabrook.

 

Non-Mandatory Pre-Bid meeting April 01, 2025 at Seabrook City Hall

 

PUBLISHED:        Wednesday, March 19, 2025

                           Wednesday, March 26, 2025","RFP 2025-05-422","N/A","N/A","N/A","N/A","RFP 2025-05-422","N/A","N/A"
"4/08/2025","State: TX","231-068-40 DST (J) & 231-068-41 DST(I)","WCMUD No. 58 Water, Wastewater & Storm to serve Lakes of Cane Island Collector Road & Lakes of Cane Island Water Line and Force Main","https://www.civcastusa.com/project/67d82305cd859d96020c68d1/summary","231-068-40 DST (J) & 231-068-41 DST(I)","N/A","N/A","N/A","Waller County, TX","Project scope shall include approximately 9,094 LF of 6”-8” PVC water line; 8,865 LF of 8” PVC gravity sanitary sewer and 2,677 LF of 24”-54” RCP storm sewer.","231-068-40 DST (J) & 231-068-41 DST(I)","N/A","N/A","N/A","N/A","231-068-40 DST (J) & 231-068-41 DST(I)","N/A","N/A"
"4/03/2025","State: TX","081-011-25-01 DST (J) / ROAD (L)","BCMUD No. 57, Water, Wastewater, Storm & Paving to serve Meridiana Section Twenty Five-A","https://www.civcastusa.com/project/67cb382e39a8672914d90778/summary","081-011-25-01 DST (J) / ROAD (L)","N/A","N/A","N/A","Brazoria County, TX","Project scope shall include the installation of approximately 3,085 LF of 8” PVC waterline; 2,560 LF of 8”-12” PVC sanitary sewer; 2,345 LF of 24”-60” RCP storm sewer; and 10,215 SY of 6” concrete paving.","081-011-25-01 DST (J) / ROAD (L)","N/A","N/A","N/A","N/A","081-011-25-01 DST (J) / ROAD (L)","N/A","N/A"
"4/03/2025","State: TX","05282-0236-01","FBC MUD 151 - 2024 Wastewater Treatment Plant Improvements","https://www.civcastusa.com/project/67c8c795570f5c665d35c545/summary","05282-0236-01","N/A","N/A","N/A","Fort Bend County, TX","Scope of Work of the Contract Documents includes the following: rehabilitation, improvements, and construction at the wastewater treatment plant.

MPU No. 1: The work at MPU No. 1 includes, but is not limited to: demolition of the existing diffuser systems and installation of new fine bubble diffuser system at Digester Nos. 1 & 2; replacement of the wash press motor at the Headworks; construction of a new above basin walkway with handrails; installation of 2 slide gates; piping modifications; mud valve replacements; protective coatings including blast and recoating internal recycle riser and discharge piping, Clarifier No. 1 Drive, and Sludge Draw Off Piping; and replacement of coarse bubble drops at Chlorine Contact Basin No. 1.

MPU No. 2: The work at MPU No. 2 includes, but is not limited to: demolition of the existing diffuser systems and installation of new fine bubble diffuser system at Digester Nos. 1 & 2, construction of a new above basin walkway with handrails; construction of clarifier loading basin, installation of 3 slide gates; and protective coatings including blast and recoating internal recycle riser and discharge piping, Clarifier No. 2 Drive, and Sludge Draw Off Piping.

This project also includes blast and recoating piping at the Reclaimed Water Supply Pump Station, GSTs, and Booster Pumps.","05282-0236-01","N/A","N/A","N/A","N/A","05282-0236-01","N/A","N/A"